{
  "schemaVersion": "1.0.0",
  "mappingVersion": "ansi64-draft.0.1",
  "artifactState": "integration_draft",
  "layout": "macbook-ansi-lower-five-rows",
  "noteNaming": "C4=MIDI60",
  "midiNoteRange": {
    "min": 33,
    "max": 96
  },
  "statusNote": "64-key bijection for integration; not musically approved; capture requires target-Mac tests.",
  "keys": [
    {
      "physicalKeyID": "grave",
      "physicalRow": 1,
      "positionInRow": 1,
      "sdkConstantCandidate": "kVK_ANSI_Grave",
      "captureStatus": "unverified",
      "eventSemantics": "ordinary",
      "midiNote": 54,
      "noteName": "F#3",
      "pianoKeyColor": "black",
      "displayLabel": "`",
      "labelParts": {
        "main": "`",
        "side": null
      },
      "accessibleName": "反引号",
      "velocity": 64
    },
    {
      "physicalKeyID": "digit1",
      "physicalRow": 1,
      "positionInRow": 2,
      "sdkConstantCandidate": "kVK_ANSI_1",
      "captureStatus": "unverified",
      "eventSemantics": "ordinary",
      "midiNote": 56,
      "noteName": "G#3",
      "pianoKeyColor": "black",
      "displayLabel": "1",
      "labelParts": {
        "main": "1",
        "side": null
      },
      "accessibleName": "1",
      "velocity": 64
    },
    {
      "physicalKeyID": "digit2",
      "physicalRow": 1,
      "positionInRow": 3,
      "sdkConstantCandidate": "kVK_ANSI_2",
      "captureStatus": "unverified",
      "eventSemantics": "ordinary",
      "midiNote": 58,
      "noteName": "A#3",
      "pianoKeyColor": "black",
      "displayLabel": "2",
      "labelParts": {
        "main": "2",
        "side": null
      },
      "accessibleName": "2",
      "velocity": 64
    },
    {
      "physicalKeyID": "digit3",
      "physicalRow": 1,
      "positionInRow": 4,
      "sdkConstantCandidate": "kVK_ANSI_3",
      "captureStatus": "unverified",
      "eventSemantics": "ordinary",
      "midiNote": 61,
      "noteName": "C#4",
      "pianoKeyColor": "black",
      "displayLabel": "3",
      "labelParts": {
        "main": "3",
        "side": null
      },
      "accessibleName": "3",
      "velocity": 64
    },
    {
      "physicalKeyID": "digit4",
      "physicalRow": 1,
      "positionInRow": 5,
      "sdkConstantCandidate": "kVK_ANSI_4",
      "captureStatus": "unverified",
      "eventSemantics": "ordinary",
      "midiNote": 63,
      "noteName": "D#4",
      "pianoKeyColor": "black",
      "displayLabel": "4",
      "labelParts": {
        "main": "4",
        "side": null
      },
      "accessibleName": "4",
      "velocity": 64
    },
    {
      "physicalKeyID": "digit5",
      "physicalRow": 1,
      "positionInRow": 6,
      "sdkConstantCandidate": "kVK_ANSI_5",
      "captureStatus": "unverified",
      "eventSemantics": "ordinary",
      "midiNote": 66,
      "noteName": "F#4",
      "pianoKeyColor": "black",
      "displayLabel": "5",
      "labelParts": {
        "main": "5",
        "side": null
      },
      "accessibleName": "5",
      "velocity": 64
    },
    {
      "physicalKeyID": "digit6",
      "physicalRow": 1,
      "positionInRow": 7,
      "sdkConstantCandidate": "kVK_ANSI_6",
      "captureStatus": "unverified",
      "eventSemantics": "ordinary",
      "midiNote": 68,
      "noteName": "G#4",
      "pianoKeyColor": "black",
      "displayLabel": "6",
      "labelParts": {
        "main": "6",
        "side": null
      },
      "accessibleName": "6",
      "velocity": 64
    },
    {
      "physicalKeyID": "digit7",
      "physicalRow": 1,
      "positionInRow": 8,
      "sdkConstantCandidate": "kVK_ANSI_7",
      "captureStatus": "unverified",
      "eventSemantics": "ordinary",
      "midiNote": 70,
      "noteName": "A#4",
      "pianoKeyColor": "black",
      "displayLabel": "7",
      "labelParts": {
        "main": "7",
        "side": null
      },
      "accessibleName": "7",
      "velocity": 64
    },
    {
      "physicalKeyID": "digit8",
      "physicalRow": 1,
      "positionInRow": 9,
      "sdkConstantCandidate": "kVK_ANSI_8",
      "captureStatus": "unverified",
      "eventSemantics": "ordinary",
      "midiNote": 73,
      "noteName": "C#5",
      "pianoKeyColor": "black",
      "displayLabel": "8",
      "labelParts": {
        "main": "8",
        "side": null
      },
      "accessibleName": "8",
      "velocity": 64
    },
    {
      "physicalKeyID": "digit9",
      "physicalRow": 1,
      "positionInRow": 10,
      "sdkConstantCandidate": "kVK_ANSI_9",
      "captureStatus": "unverified",
      "eventSemantics": "ordinary",
      "midiNote": 75,
      "noteName": "D#5",
      "pianoKeyColor": "black",
      "displayLabel": "9",
      "labelParts": {
        "main": "9",
        "side": null
      },
      "accessibleName": "9",
      "velocity": 64
    },
    {
      "physicalKeyID": "digit0",
      "physicalRow": 1,
      "positionInRow": 11,
      "sdkConstantCandidate": "kVK_ANSI_0",
      "captureStatus": "unverified",
      "eventSemantics": "ordinary",
      "midiNote": 78,
      "noteName": "F#5",
      "pianoKeyColor": "black",
      "displayLabel": "0",
      "labelParts": {
        "main": "0",
        "side": null
      },
      "accessibleName": "0",
      "velocity": 64
    },
    {
      "physicalKeyID": "minus",
      "physicalRow": 1,
      "positionInRow": 12,
      "sdkConstantCandidate": "kVK_ANSI_Minus",
      "captureStatus": "unverified",
      "eventSemantics": "ordinary",
      "midiNote": 80,
      "noteName": "G#5",
      "pianoKeyColor": "black",
      "displayLabel": "-",
      "labelParts": {
        "main": "-",
        "side": null
      },
      "accessibleName": "减号",
      "velocity": 64
    },
    {
      "physicalKeyID": "equal",
      "physicalRow": 1,
      "positionInRow": 13,
      "sdkConstantCandidate": "kVK_ANSI_Equal",
      "captureStatus": "unverified",
      "eventSemantics": "ordinary",
      "midiNote": 82,
      "noteName": "A#5",
      "pianoKeyColor": "black",
      "displayLabel": "=",
      "labelParts": {
        "main": "=",
        "side": null
      },
      "accessibleName": "等号",
      "velocity": 64
    },
    {
      "physicalKeyID": "delete",
      "physicalRow": 1,
      "positionInRow": 14,
      "sdkConstantCandidate": "kVK_Delete",
      "captureStatus": "unverified",
      "eventSemantics": "ordinary",
      "midiNote": 85,
      "noteName": "C#6",
      "pianoKeyColor": "black",
      "displayLabel": "⌫",
      "labelParts": {
        "main": "⌫",
        "side": null
      },
      "accessibleName": "Delete／向后删除",
      "velocity": 64
    },
    {
      "physicalKeyID": "tab",
      "physicalRow": 2,
      "positionInRow": 1,
      "sdkConstantCandidate": "kVK_Tab",
      "captureStatus": "unverified",
      "eventSemantics": "ordinary",
      "midiNote": 49,
      "noteName": "C#3",
      "pianoKeyColor": "black",
      "displayLabel": "⇥",
      "labelParts": {
        "main": "⇥",
        "side": null
      },
      "accessibleName": "Tab",
      "velocity": 64
    },
    {
      "physicalKeyID": "keyQ",
      "physicalRow": 2,
      "positionInRow": 2,
      "sdkConstantCandidate": "kVK_ANSI_Q",
      "captureStatus": "unverified",
      "eventSemantics": "ordinary",
      "midiNote": 81,
      "noteName": "A5",
      "pianoKeyColor": "white",
      "displayLabel": "Q",
      "labelParts": {
        "main": "Q",
        "side": null
      },
      "accessibleName": "Q",
      "velocity": 64
    },
    {
      "physicalKeyID": "keyW",
      "physicalRow": 2,
      "positionInRow": 3,
      "sdkConstantCandidate": "kVK_ANSI_W",
      "captureStatus": "unverified",
      "eventSemantics": "ordinary",
      "midiNote": 83,
      "noteName": "B5",
      "pianoKeyColor": "white",
      "displayLabel": "W",
      "labelParts": {
        "main": "W",
        "side": null
      },
      "accessibleName": "W",
      "velocity": 64
    },
    {
      "physicalKeyID": "keyE",
      "physicalRow": 2,
      "positionInRow": 4,
      "sdkConstantCandidate": "kVK_ANSI_E",
      "captureStatus": "unverified",
      "eventSemantics": "ordinary",
      "midiNote": 65,
      "noteName": "F4",
      "pianoKeyColor": "white",
      "displayLabel": "E",
      "labelParts": {
        "main": "E",
        "side": null
      },
      "accessibleName": "E",
      "velocity": 64
    },
    {
      "physicalKeyID": "keyR",
      "physicalRow": 2,
      "positionInRow": 5,
      "sdkConstantCandidate": "kVK_ANSI_R",
      "captureStatus": "unverified",
      "eventSemantics": "ordinary",
      "midiNote": 84,
      "noteName": "C6",
      "pianoKeyColor": "white",
      "displayLabel": "R",
      "labelParts": {
        "main": "R",
        "side": null
      },
      "accessibleName": "R",
      "velocity": 64
    },
    {
      "physicalKeyID": "keyT",
      "physicalRow": 2,
      "positionInRow": 6,
      "sdkConstantCandidate": "kVK_ANSI_T",
      "captureStatus": "unverified",
      "eventSemantics": "ordinary",
      "midiNote": 86,
      "noteName": "D6",
      "pianoKeyColor": "white",
      "displayLabel": "T",
      "labelParts": {
        "main": "T",
        "side": null
      },
      "accessibleName": "T",
      "velocity": 64
    },
    {
      "physicalKeyID": "keyY",
      "physicalRow": 2,
      "positionInRow": 7,
      "sdkConstantCandidate": "kVK_ANSI_Y",
      "captureStatus": "unverified",
      "eventSemantics": "ordinary",
      "midiNote": 88,
      "noteName": "E6",
      "pianoKeyColor": "white",
      "displayLabel": "Y",
      "labelParts": {
        "main": "Y",
        "side": null
      },
      "accessibleName": "Y",
      "velocity": 64
    },
    {
      "physicalKeyID": "keyU",
      "physicalRow": 2,
      "positionInRow": 8,
      "sdkConstantCandidate": "kVK_ANSI_U",
      "captureStatus": "unverified",
      "eventSemantics": "ordinary",
      "midiNote": 71,
      "noteName": "B4",
      "pianoKeyColor": "white",
      "displayLabel": "U",
      "labelParts": {